{
  "schema": "coding-policy-decision-v1",
  "decision_id": "coding-1",
  "run_id": "run-1",
  "stage_id": "stage-1",
  "context_sha256": "1111111111111111111111111111111111111111111111111111111111111111",
  "core_policy_sha256": "2222222222222222222222222222222222222222222222222222222222222222",
  "provider": {
    "provider_id": "jinny-android-practices",
    "provider_version": "1.0.0",
    "provider_manifest_sha256": "3333333333333333333333333333333333333333333333333333333333333333",
    "skill_id": "jinny-android-coding-practices",
    "skill_version": "1.0.0"
  },
  "outcome": {
    "type": "applied",
    "rules": [{
      "rule_id": "rule-1",
      "effect": "recommend",
      "statement": "Prefer a clear local name",
      "scope": {
        "component_layers": ["application"],
        "path_patterns": ["src/**"],
        "languages": ["java"]
      },
      "evidence_requirements": []
    }]
  },
  "created_at": "2026-09-01T00:00:00Z"
}
